{
  "$schema": "../../../schemas/lift.schema.json",
  "country_code": "kr",
  "region_slug": "gangwon",
  "place_slug": "alpensia",
  "lifts": [
    {
      "id": "lift-1",
      "name": "Lift 1",
      "name_i18n": {
        "ko": "리프트 1",
        "en": "Lift 1",
        "ja": "リフト 1"
      },
      "capacity_per_hour": 2400,
      "length_m": 541,
      "seats": 4,
      "cabin_count": 45,
      "speed_mps": 5,
      "type": "chair_lift",
      "coordinates": [
        {
          "lat": 37.6564143,
          "lon": 128.672134
        },
        {
          "lat": 37.6555741,
          "lon": 128.671629
        },
        {
          "lat": 37.6533785,
          "lon": 128.6699141
        },
        {
          "lat": 37.6518552,
          "lon": 128.6689502
        }
      ],
      "connected_slope_ids": [
        "lift-1"
      ]
    },
    {
      "id": "lift-2",
      "name": "Lift 2",
      "name_i18n": {
        "ko": "리프트 2",
        "en": "Lift 2",
        "ja": "リフト 2"
      },
      "capacity_per_hour": 3085,
      "length_m": 664,
      "seats": 6,
      "cabin_count": 43,
      "speed_mps": 5,
      "type": "chair_lift",
      "coordinates": [
        {
          "lat": 37.6561029,
          "lon": 128.6731383
        },
        {
          "lat": 37.6550611,
          "lon": 128.6730511
        },
        {
          "lat": 37.6538699,
          "lon": 128.672972
        },
        {
          "lat": 37.6525848,
          "lon": 128.6729257
        },
        {
          "lat": 37.6505446,
          "lon": 128.6730091
        },
        {
          "lat": 37.650243,
          "lon": 128.6730091
        }
      ],
      "connected_slope_ids": [
        "1",
        "2",
        "3",
        "4",
        "5"
      ]
    },
    {
      "id": "lift-3",
      "name": "Lift 3",
      "name_i18n": {
        "ko": "리프트 3",
        "en": "Lift 3",
        "ja": "リフト 3"
      },
      "capacity_per_hour": 3085,
      "length_m": 651,
      "seats": 6,
      "cabin_count": 44,
      "speed_mps": 5,
      "type": "chair_lift",
      "coordinates": [
        {
          "lat": 37.6561422,
          "lon": 128.6746726
        },
        {
          "lat": 37.6559344,
          "lon": 128.6745954
        },
        {
          "lat": 37.6546027,
          "lon": 128.6743738
        },
        {
          "lat": 37.6505423,
          "lon": 128.673582
        },
        {
          "lat": 37.6502592,
          "lon": 128.6735664
        }
      ],
      "connected_slope_ids": [
        "1",
        "2",
        "3",
        "4",
        "5"
      ]
    }
  ]
}
