{
  "country_code": "kr",
  "region_slug": "gangwon",
  "place_slug": "high1",
  "lifts": [
    {
      "id": "hera-l535760430",
      "name": "Hera",
      "name_i18n": {
        "en": "Hera"
      },
      "type": "chair_lift",
      "capacity_per_hour": null,
      "length_m": 1174.3,
      "vertical_m": null,
      "connected_slope_ids": [
        "athena1",
        "hera2",
        "unnamed-105836169500"
      ],
      "connected_lift_ids": []
    },
    {
      "id": "victoria-l535760431",
      "name": "Victoria",
      "name_i18n": {
        "en": "Victoria"
      },
      "type": "chair_lift",
      "capacity_per_hour": null,
      "length_m": 1172.9,
      "vertical_m": null,
      "connected_slope_ids": [
        "victoria1",
        "victoria3",
        "zeus1"
      ],
      "connected_lift_ids": []
    },
    {
      "id": "apollo-l535760433",
      "name": "Apollo",
      "name_i18n": {
        "en": "Apollo"
      },
      "type": "chair_lift",
      "capacity_per_hour": null,
      "length_m": 1102.8,
      "vertical_m": null,
      "connected_slope_ids": [],
      "connected_lift_ids": []
    },
    {
      "id": "zeus-l535760435",
      "name": "Zeus",
      "name_i18n": {
        "en": "Zeus"
      },
      "type": "chair_lift",
      "capacity_per_hour": null,
      "length_m": 1898.2,
      "vertical_m": null,
      "connected_slope_ids": [],
      "connected_lift_ids": []
    },
    {
      "id": "jupiter-l535760436",
      "name": "Jupiter",
      "name_i18n": {
        "en": "Jupiter"
      },
      "type": "chair_lift",
      "capacity_per_hour": null,
      "length_m": 981.5,
      "vertical_m": null,
      "connected_slope_ids": [
        "zeus3"
      ],
      "connected_lift_ids": []
    },
    {
      "id": "mountain-gondola-l535760437",
      "name": "Mountain Gondola",
      "name_i18n": {
        "en": "Mountain Gondola"
      },
      "type": "gondola",
      "capacity_per_hour": null,
      "length_m": 2846.5,
      "vertical_m": null,
      "connected_slope_ids": [
        "athena1"
      ],
      "connected_lift_ids": []
    },
    {
      "id": "athena-l535760438",
      "name": "Athena",
      "name_i18n": {
        "en": "Athena"
      },
      "type": "chair_lift",
      "capacity_per_hour": null,
      "length_m": 1534.5,
      "vertical_m": null,
      "connected_slope_ids": [
        "apollo3"
      ],
      "connected_lift_ids": []
    },
    {
      "id": "high1-gondola-l53576043900",
      "name": "High1 Gondola",
      "name_i18n": {
        "en": "High1 Gondola"
      },
      "type": "gondola",
      "capacity_per_hour": null,
      "length_m": 1671.3,
      "vertical_m": null,
      "connected_slope_ids": [
        "zeus2"
      ],
      "connected_lift_ids": []
    },
    {
      "id": "high1-gondola-l53576043910",
      "name": "High1 Gondola",
      "name_i18n": {
        "en": "High1 Gondola"
      },
      "type": "gondola",
      "capacity_per_hour": null,
      "length_m": 43.5,
      "vertical_m": null,
      "connected_slope_ids": [
        "zeus2"
      ],
      "connected_lift_ids": []
    },
    {
      "id": "high1-gondola-l53576043911",
      "name": "High1 Gondola",
      "name_i18n": {
        "en": "High1 Gondola"
      },
      "type": "gondola",
      "capacity_per_hour": null,
      "length_m": 737.7,
      "vertical_m": null,
      "connected_slope_ids": [
        "athena1"
      ],
      "connected_lift_ids": []
    },
    {
      "id": "valley-gondola-l632081931",
      "name": "Valley Gondola",
      "name_i18n": {
        "en": "Valley Gondola"
      },
      "type": "gondola",
      "capacity_per_hour": null,
      "length_m": 1193.2,
      "vertical_m": null,
      "connected_slope_ids": [],
      "connected_lift_ids": []
    }
  ]
}
