{
  "$schema": "../../../../schemas/lift.schema.json",
  "country_code": "kr",
  "region_slug": "gyeonggi",
  "place_slug": "jisan-forest",
  "lifts": [
    {
      "id": "1-1",
      "name": "Lemon",
      "name_i18n": {
        "ko": "레몬",
        "en": "Lemon",
        "ja": "ラエマオン"
      },
      "capacity_per_hour": 1280,
      "length_m": 300,
      "vertical_m": 42,
      "seats": 4,
      "connected_slope_ids": [],
      "connected_lift_ids": []
    },
    {
      "id": "1",
      "name": "Orange",
      "name_i18n": {
        "ko": "오렌지",
        "en": "Orange",
        "ja": "オレンジ"
      },
      "capacity_per_hour": 2400,
      "length_m": 300,
      "vertical_m": 44,
      "seats": 4,
      "connected_slope_ids": [],
      "connected_lift_ids": []
    },
    {
      "id": "2",
      "name": "New Orange",
      "name_i18n": {
        "ko": "뉴오렌지",
        "en": "New Orange",
        "ja": "ニューオレンジ"
      },
      "capacity_per_hour": 3200,
      "length_m": 716,
      "vertical_m": 145,
      "seats": 6,
      "connected_slope_ids": [],
      "connected_lift_ids": []
    },
    {
      "id": "3",
      "name": "Blue",
      "name_i18n": {
        "ko": "블루",
        "en": "Blue",
        "ja": "ブルー"
      },
      "capacity_per_hour": 2400,
      "length_m": 760,
      "vertical_m": 145,
      "seats": 4,
      "connected_slope_ids": [],
      "connected_lift_ids": []
    },
    {
      "id": "5",
      "name": "Silver",
      "name_i18n": {
        "ko": "실버",
        "en": "Silver",
        "ja": "シルバー"
      },
      "capacity_per_hour": 3200,
      "length_m": 652,
      "vertical_m": 209,
      "seats": 6,
      "connected_slope_ids": [],
      "connected_lift_ids": []
    }
  ]
}
