{
  "country_code": "kr",
  "region_slug": "gangwon",
  "place_slug": "oak-valley",
  "lifts": [
    {
      "id": "unnamed-1364526037-l1364526037",
      "name": "unnamed-1364526037",
      "name_i18n": {},
      "type": "cable_car",
      "capacity_per_hour": null,
      "length_m": 922.8,
      "vertical_m": null,
      "connected_slope_ids": [],
      "connected_lift_ids": [],
      "coordinates": [
        {
          "lat": 37.368036,
          "lon": 127.82637,
          "alt_m": null
        },
        {
          "lat": 37.36787,
          "lon": 127.826635,
          "alt_m": null
        },
        {
          "lat": 37.367705,
          "lon": 127.826899,
          "alt_m": null
        },
        {
          "lat": 37.367539,
          "lon": 127.827164,
          "alt_m": null
        },
        {
          "lat": 37.367374,
          "lon": 127.827429,
          "alt_m": null
        },
        {
          "lat": 37.367208,
          "lon": 127.827693,
          "alt_m": null
        },
        {
          "lat": 37.367042,
          "lon": 127.827958,
          "alt_m": null
        },
        {
          "lat": 37.366877,
          "lon": 127.828223,
          "alt_m": null
        },
        {
          "lat": 37.366711,
          "lon": 127.828487,
          "alt_m": null
        },
        {
          "lat": 37.366546,
          "lon": 127.828752,
          "alt_m": null
        },
        {
          "lat": 37.36638,
          "lon": 127.829017,
          "alt_m": null
        },
        {
          "lat": 37.366215,
          "lon": 127.829282,
          "alt_m": null
        },
        {
          "lat": 37.366049,
          "lon": 127.829546,
          "alt_m": null
        },
        {
          "lat": 37.365883,
          "lon": 127.829811,
          "alt_m": null
        },
        {
          "lat": 37.365718,
          "lon": 127.830076,
          "alt_m": null
        },
        {
          "lat": 37.365552,
          "lon": 127.83034,
          "alt_m": null
        },
        {
          "lat": 37.365387,
          "lon": 127.830605,
          "alt_m": null
        },
        {
          "lat": 37.365221,
          "lon": 127.83087,
          "alt_m": null
        },
        {
          "lat": 37.365055,
          "lon": 127.831134,
          "alt_m": null
        },
        {
          "lat": 37.36489,
          "lon": 127.831399,
          "alt_m": null
        },
        {
          "lat": 37.364724,
          "lon": 127.831664,
          "alt_m": null
        },
        {
          "lat": 37.364559,
          "lon": 127.831928,
          "alt_m": null
        },
        {
          "lat": 37.364393,
          "lon": 127.832193,
          "alt_m": null
        },
        {
          "lat": 37.364228,
          "lon": 127.832458,
          "alt_m": null
        },
        {
          "lat": 37.364062,
          "lon": 127.832723,
          "alt_m": null
        },
        {
          "lat": 37.363896,
          "lon": 127.832987,
          "alt_m": null
        },
        {
          "lat": 37.363731,
          "lon": 127.833252,
          "alt_m": null
        },
        {
          "lat": 37.363565,
          "lon": 127.833517,
          "alt_m": null
        },
        {
          "lat": 37.3634,
          "lon": 127.833781,
          "alt_m": null
        },
        {
          "lat": 37.363234,
          "lon": 127.834046,
          "alt_m": null
        },
        {
          "lat": 37.363068,
          "lon": 127.834311,
          "alt_m": null
        },
        {
          "lat": 37.362903,
          "lon": 127.834575,
          "alt_m": null
        }
      ]
    }
  ]
}
