{
  "country_code": "kr",
  "region_slug": "gyeongsangnam-do",
  "place_slug": "eden-valley",
  "lifts": [
    {
      "id": "unnamed-295407268-l295407268",
      "name": "unnamed-295407268",
      "name_i18n": {},
      "type": "chair_lift",
      "capacity_per_hour": null,
      "length_m": 514.3,
      "vertical_m": null,
      "connected_slope_ids": [
        "unnamed"
      ],
      "connected_lift_ids": []
    },
    {
      "id": "unnamed-295407272-l295407272",
      "name": "unnamed-295407272",
      "name_i18n": {},
      "type": "chair_lift",
      "capacity_per_hour": null,
      "length_m": 968.3,
      "vertical_m": null,
      "connected_slope_ids": [
        "unnamed"
      ],
      "connected_lift_ids": []
    },
    {
      "id": "unnamed-295407274-l295407274",
      "name": "unnamed-295407274",
      "name_i18n": {},
      "type": "chair_lift",
      "capacity_per_hour": null,
      "length_m": 789.0,
      "vertical_m": null,
      "connected_slope_ids": [
        "unnamed"
      ],
      "connected_lift_ids": []
    }
  ]
}
